code;name;location;reference product;categories;classifications;ex_name;ex_amount;ex_unit;ex_product;ex_production volume;ex_type;ex_location
413553715ec6748ed45720ac5cad4fe3;energy and auxilliary inputs, metal working factory, with heating from natural gas;RER;energy and auxilliary inputs, metal working factory;;"[('EcoSpold01Categories', 'metals/general manufacturing'), ('ISIC rev.4 ecoinvent', '259:Manufacture of other fabricated metal products; metalworking service activit'), ('CPC', '54269: General construction services of other industrial plants')]";market for wastewater, average;-0.00118120941654813;cubic meter;wastewater, average;1049070000.0;technosphere;CH
41552154f6f5503a37c08523c138aaed;treatment of low level radioactive waste for final repository;RoW;low level radioactive waste for final repository;;"[('EcoSpold01Categories', 'nuclear power/waste treatment'), ('ISIC rev.4 ecoinvent', '3822:Treatment and disposal of hazardous waste'), ('CPC', '33690: Other radioactive elements and isotopes and compounds; alloys, dispersions, ceramic products and mixtures cont[…]')]";market for wastewater, unpolluted;-0.0023;cubic meter;wastewater, unpolluted;0.0069;technosphere;RoW
417e295a80bc8dc69ed3dea036cba42e;fish curing, small fish;RoW;fish curing, small fish;;[('ISIC rev.4 ecoinvent', '1020:Processing and preserving of fish, crustaceans and molluscs'), ('CPC', '21242: Fish, otherwise prepared or preserved')];market for wastewater from vegetable oil refinery;-0.0079744;cubic meter;wastewater from vegetable oil refinery;1704025.6128;technosphere;GLO
417f155fda69fd59b5f2e9359019cc78;electricity production, photovoltaic, 3kWp slanted-roof installation, multi-Si, panel, mounted;IN-HR;electricity, low voltage;;[('ISIC rev.4 ecoinvent', '3510:Electric power generation, transmission and distribution'), ('EcoSpold01Categories', 'photovoltaic/power plants'), ('CPC', '17100: Electrical energy')];market for wastewater, from residence;-4.01365733173514e-06;cubic meter;wastewater, from residence;37.0168998225673;technosphere;RoW
4184106959d562ef32f47c05e83e5540;synthetic gas production, from wood, at fixed bed gasifier;CH;synthetic gas;;"[('ISIC rev.4 ecoinvent', '3520:Manufacture of gas; distribution of gaseous fuels through mains'), ('EcoSpold01Categories', 'biomass/fuels'), ('CPC', '17200: Coal gas, water gas, producer gas and similar gases, other than petroleum gases and other gaseous hydrocarbons')]";market for wastewater, from residence;-0.00010147;cubic meter;wastewater, from residence;59.5547724;technosphere;CH
4216152e0c9487138fb1ba7b2eb431cb;treatment of tallow to esterquat;RER;tallow, unrefined;;[('ISIC rev.4 ecoinvent', '2023:Manufacture of soap and detergents, cleaning and polishing preparations, pe'), ('EcoSpold01Categories', 'washing agents/tensides'), ('CPC', '2151: Animal fats, unrendered')];market for wastewater, unpolluted;-0.000433333333333333;cubic meter;wastewater, unpolluted;2100.41;technosphere;CH
42b4c94a68a67ceb526a527871199316;molybdenum production;RoW;molybdenum;;[('EcoSpold01Categories', 'metals/extraction'), ('ISIC rev.4 ecoinvent', '2420:Manufacture of basic precious and other non-ferrous metals'), ('CPC', '41601: Tungsten, molybdenum, tantalum, magnesium, cobalt, cadmium, titanium, zirconium, beryllium, gallium, hafnium, […]')];market for wastewater, unpolluted;-0.03896;cubic meter;wastewater, unpolluted;7090720.0;technosphere;RoW
42c88c234f7cb0657d8a8a4b91576e24;autoclaved aerated concrete block production;IN;autoclaved aerated concrete block;;[('ISIC rev.4 ecoinvent', '2395:Manufacture of articles of concrete, cement and plaster'), ('EcoSpold01Categories', 'construction materials/bricks'), ('CPC', '37510: Non-refractory mortars and concretes')];market for wastewater from concrete production;-8.33e-05;cubic meter;wastewater from concrete production;224910.0;technosphere;RoW
42e7cbed42db00824820a6adba1bd117;electricity production, photovoltaic, 3kWp slanted-roof installation, multi-Si, panel, mounted;PT;electricity, low voltage;;[('EcoSpold01Categories', 'photovoltaic/power plants'), ('ISIC rev.4 ecoinvent', '3510:Electric power generation, transmission and distribution'), ('CPC', '17100: Electrical energy')];market for wastewater, from residence;-4.03794572708603e-06;cubic meter;wastewater, from residence;407.043100046044;technosphere;RoW
431406573f8883147db9ae2a245b0daf;concrete production, 25MPa, ready-mix, with cement limestone 6-10%;BR;concrete, 25MPa;;[('ISIC rev.4 ecoinvent', '2395:Manufacture of articles of concrete, cement and plaster'), ('EcoSpold01Categories', 'construction materials/concrete'), ('CPC', '37510: Non-refractory mortars and concretes')];market for wastewater from concrete production;-0.161;cubic meter;wastewater from concrete production;297079.615;technosphere;RoW
434635c18d1aa57b0e84be429f8d3728;gas motor production, 206kW;RER;gas motor, 206kW;;[('EcoSpold01Categories', 'natural gas/cogeneration'), ('ISIC rev.4 ecoinvent', '2710:Manufacture of electric motors, generators, transformers and electricity di'), ('CPC', '431: Engines and turbines and parts thereof')];market for wastewater from pig iron production;-1.29311717405694;cubic meter;wastewater from pig iron production;1.68;technosphere;Europe without Switzerland
434635c18d1aa57b0e84be429f8d3728;gas motor production, 206kW;RER;gas motor, 206kW;;[('EcoSpold01Categories', 'natural gas/cogeneration'), ('ISIC rev.4 ecoinvent', '2710:Manufacture of electric motors, generators, transformers and electricity di'), ('CPC', '431: Engines and turbines and parts thereof')];market for wastewater from pig iron production;-0.386882825943058;cubic meter;wastewater from pig iron production;1.68;technosphere;CH
434b76ab137b8f5d1f2444e36b7c2da8;concrete production, 25MPa, ready-mix, with cement blast furnace slag 6-34%;RoW;concrete, 25MPa;;[('EcoSpold01Categories', 'construction materials/concrete'), ('ISIC rev.4 ecoinvent', '2395:Manufacture of articles of concrete, cement and plaster'), ('CPC', '37510: Non-refractory mortars and concretes')];market for wastewater from concrete production;-0.161;cubic meter;wastewater from concrete production;1741938.99285;technosphere;CH
437d92566c03dfffc0130fcacb6893d9;heat and power co-generation, wood chips, 6667 kW, state-of-the-art 2014;SI;heat, district or industrial, other than natural gas;;[('ISIC rev.4 ecoinvent', '3530:Steam and air conditioning supply'), ('CPC', '17300: Steam and hot water')];market for wastewater, average;-1.74888888888889e-06;cubic meter;wastewater, average;968.9544;technosphere;Europe without Switzerland
43ddc236ee5d451652eab054d693d348;electricity production, photovoltaic, 3kWp slanted-roof installation, multi-Si, panel, mounted;CL;electricity, low voltage;;[('EcoSpold01Categories', 'photovoltaic/power plants'), ('ISIC rev.4 ecoinvent', '3510:Electric power generation, transmission and distribution'), ('CPC', '17100: Electrical energy')];market for wastewater, from residence;-5.11808653040051e-06;cubic meter;wastewater, from residence;0.0;technosphere;RoW
4406515e401a5055049a1f6fedecbc8e;dipropylene glycol monomethyl ether production;RER;dipropylene glycol monomethyl ether;;[('ISIC rev.4 ecoinvent', '2011:Manufacture of basic chemicals'), ('CPC', '34170: Ethers, alcohol peroxides, ether peroxides, epoxides, acetals and hemiacetals, and their halogenated, sulphona[…]')];market for wastewater, average;-2.43642434506777e-06;cubic meter;wastewater, average;51.03;technosphere;Europe without Switzerland
4406515e401a5055049a1f6fedecbc8e;dipropylene glycol monomethyl ether production;RER;dipropylene glycol monomethyl ether;;[('ISIC rev.4 ecoinvent', '2011:Manufacture of basic chemicals'), ('CPC', '34170: Ethers, alcohol peroxides, ether peroxides, epoxides, acetals and hemiacetals, and their halogenated, sulphona[…]')];market for wastewater, average;-2.63575654932227e-07;cubic meter;wastewater, average;51.03;technosphere;CH
44073f15c2364239e6faa079667a9829;market for naphtha;BR;naphtha;;[('ISIC rev.4 ecoinvent', '1920:Manufacture of refined petroleum products'), ('CPC', '33330: Naphtha')];market for wastewater, average;-6.89e-07;cubic meter;wastewater, average;0.0;technosphere;RoW
4479c663da3bf38e6d3da0a5f2242912;electricity production, photovoltaic, 3kWp slanted-roof installation, single-Si, panel, mounted;CA-AB;electricity, low voltage;;[('ISIC rev.4 ecoinvent', '3510:Electric power generation, transmission and distribution'), ('EcoSpold01Categories', 'photovoltaic/power plants'), ('CPC', '17100: Electrical energy')];market for wastewater, from residence;-4.6991655687308e-06;cubic meter;wastewater, from residence;0.0;technosphere;RoW
44a875f3715889c42b067c5fb19059b6;market for diesel, low-sulfur;PE;diesel, low-sulfur;;[('ISIC rev.4 ecoinvent', '1920:Manufacture of refined petroleum products'), ('CPC', '33360: Gas oil')];market for wastewater, average;-6.89e-07;cubic meter;wastewater, average;0.0;technosphere;RoW
44c3a94a4e3b416a31a8d587bde089fc;photovoltaic cell production, ribbon-Si;RER;photovoltaic cell, ribbon-Si;;"[('ISIC rev.4 ecoinvent', '2610:Manufacture of electronic components and boards'), ('EcoSpold01Categories', 'photovoltaic/production of components'), ('CPC', '47150: Diodes, transistors and similar semi-conductor devices; photosensitive semi-conductor devices; light emitting […]')]";market for wastewater from PV cell production;-0.21734;cubic meter;wastewater from PV cell production;4516.151328;technosphere;GLO
44eaf3545f621a3606d7059e7764a0fa;uranium fuel element production, enriched 3.8%, for light water reactor;FR;uranium, enriched 3.8%, in fuel element for light water reactor;;"[('EcoSpold01Categories', 'nuclear power/production'), ('ISIC rev.4 ecoinvent', '2011:Manufacture of basic chemicals'), ('CPC', '33620: Uranium enriched in U235 and its compounds; plutonium and its compounds; alloys, dispersions, ceramic products[…]')]";market for wastewater, unpolluted;-0.135;cubic meter;wastewater, unpolluted;16474.5762711865;technosphere;RoW
45256b0edc93971e5b659cc2fa265ab9;electricity production, photovoltaic, 3kWp slanted-roof installation, single-Si, panel, mounted;SK;electricity, low voltage;;[('EcoSpold01Categories', 'photovoltaic/power plants'), ('ISIC rev.4 ecoinvent', '3510:Electric power generation, transmission and distribution'), ('CPC', '17100: Electrical energy')];market for wastewater, from residence;-5.06276407992545e-06;cubic meter;wastewater, from residence;917.676617127287;technosphere;RoW
452838c471c90727bd6e8152faae4f73;ethanol production from potatoes;CH;ethanol, without water, in 95% solution state, from fermentation;;[('EcoSpold01Categories', 'biomass/fuels'), ('ISIC rev.4 ecoinvent', '2011:Manufacture of basic chemicals'), ('CPC', '35491: Biodiesel')];market for wastewater, from residence;-0.0112799699034886;cubic meter;wastewater, from residence;0.0;technosphere;CH
45546619cfa26d1d9163248bd25c9db4;tap water production, direct filtration treatment;IN;tap water;;[('EcoSpold01Categories', 'water supply/production'), ('ISIC rev.4 ecoinvent', '3600:Water collection, treatment and supply'), ('CPC', '18000: Natural water')];market for wastewater, unpolluted;-1.28461e-05;cubic meter;wastewater, unpolluted;45380120.0139;technosphere;RoW
456a7cea65634c8f83d699fb86a8b8b7;flat glass production, uncoated;RoW;flat glass, uncoated;;[('ISIC rev.4 ecoinvent', '2310:Manufacture of glass and glass products'), ('EcoSpold01Categories', 'glass/construction'), ('CPC', '37114: Glass in sheets, bent, edge-worked, engraved, drilled, enamelled or otherwise worked, but not framed, etc.')];market for wastewater, from residence;-0.00035;cubic meter;wastewater, from residence;12189800.0;technosphere;RoW
45d3d6648597d60e749c012d790ee0bf;carbon black production;GLO;carbon black;;"[('ISIC rev.4 ecoinvent', '2011:Manufacture of basic chemicals'), ('CPC', '34231: Chemical elements n.e.c.; inorganic acids except phosphoric, nitric and sulphonitric; inorganic oxygen compoun[…]')]";market for wastewater, average;-8.43645500899092e-07;cubic meter;wastewater, average;21870.0;technosphere;Europe without Switzerland
45d3d6648597d60e749c012d790ee0bf;carbon black production;GLO;carbon black;;"[('ISIC rev.4 ecoinvent', '2011:Manufacture of basic chemicals'), ('CPC', '34231: Chemical elements n.e.c.; inorganic acids except phosphoric, nitric and sulphonitric; inorganic oxygen compoun[…]')]";market for wastewater, average;-9.12667023214788e-08;cubic meter;wastewater, average;21870.0;technosphere;CH
45d3d6648597d60e749c012d790ee0bf;carbon black production;GLO;carbon black;;"[('ISIC rev.4 ecoinvent', '2011:Manufacture of basic chemicals'), ('CPC', '34231: Chemical elements n.e.c.; inorganic acids except phosphoric, nitric and sulphonitric; inorganic oxygen compoun[…]')]";market for wastewater, average;-1.76508779677943e-06;cubic meter;wastewater, average;21870.0;technosphere;RoW
460e72fa6a5da709bc75ea568dcb794f;synthetic gas production, from wood, at fixed bed gasifier;RoW;synthetic gas;;"[('EcoSpold01Categories', 'biomass/fuels'), ('ISIC rev.4 ecoinvent', '3520:Manufacture of gas; distribution of gaseous fuels through mains'), ('CPC', '17200: Coal gas, water gas, producer gas and similar gases, other than petroleum gases and other gaseous hydrocarbons')]";market for wastewater, from residence;-0.00010147;cubic meter;wastewater, from residence;143.3852276;technosphere;RoW
461446af86696fa06a647200a4a8cf2f;styrene production;RER;styrene;;[('ISIC rev.4 ecoinvent', '2011:Manufacture of basic chemicals'), ('CPC', '34720: Polymers of styrene, in primary forms')];market for wastewater, average;-2.43642434506777e-06;cubic meter;wastewater, average;9598.5;technosphere;Europe without Switzerland
461446af86696fa06a647200a4a8cf2f;styrene production;RER;styrene;;[('ISIC rev.4 ecoinvent', '2011:Manufacture of basic chemicals'), ('CPC', '34720: Polymers of styrene, in primary forms')];market for wastewater, average;-2.63575654932227e-07;cubic meter;wastewater, average;9598.5;technosphere;CH
467e881baeb5a5b8d9812458c6f2b2aa;market for liquefied petroleum gas;Europe without Switzerland;liquefied petroleum gas;;[('ISIC rev.4 ecoinvent', '1920:Manufacture of refined petroleum products'), ('EcoSpold01Categories', 'natural gas/fuels'), ('CPC', '334: Petroleum gases and other gaseous hydrocarbons, except natural gas')];market for wastewater, average;-6.89e-07;cubic meter;wastewater, average;0.0;technosphere;Europe without Switzerland
46af0e0f280518f91af42f7bfc87798a;extrusion, co-extrusion of plastic sheets;FR;extrusion, co-extrusion;;[('EcoSpold01Categories', 'plastics/processing'), ('ISIC rev.4 ecoinvent', '2220:Manufacture of plastics products'), ('CPC', '89200: Moulding, pressing, stamping, extruding and similar plastic manufacturing services')];treatment of wastewater, average, capacity 1E9l/year;-2.72e-05;cubic meter;wastewater, average;1577.6;technosphere;RoW
46ecd75824b40a9faa3ecb302a2fcb61;rare earth oxides production, from rare earth oxide concentrate, 70% REO;CN-SC;cerium oxide;;[('ISIC rev.4 ecoinvent', '0729:Mining of other non-ferrous metal ores'), ('CPC', '3429: Compounds of rare earth metals, of yttrium or of scandium')];market for wastewater, average;-0.0482234977893892;cubic meter;wastewater, average;255908.2049;technosphere;RoW
4707e47e38a68141e5504c11481e8b8e;ethanol production from rye;RER;ethanol, without water, in 95% solution state, from fermentation;;[('ISIC rev.4 ecoinvent', '2011:Manufacture of basic chemicals'), ('EcoSpold01Categories', 'biomass/fuels'), ('CPC', '35491: Biodiesel')];market for wastewater, from residence;-0.00301181316810785;cubic meter;wastewater, from residence;35297.6856007425;technosphere;CH
470eea4fbc952e591693909ad363861d;aircraft production, passenger aircraft, long haul;GLO;aircraft, passenger, long haul;;[('ISIC rev.4 ecoinvent', '3030:Manufacture of air and spacecraft and related machinery'), ('EcoSpold01Categories', 'transport systems/airplane'), ('CPC', '49623: Aeroplanes and other powered aircraft of an unladen weight exceeding 2000 kg')];market for wastewater, unpolluted;-3.5261261984;cubic meter;wastewater, unpolluted;25564.4149384;technosphere;CH
470eea4fbc952e591693909ad363861d;aircraft production, passenger aircraft, long haul;GLO;aircraft, passenger, long haul;;[('ISIC rev.4 ecoinvent', '3030:Manufacture of air and spacecraft and related machinery'), ('EcoSpold01Categories', 'transport systems/airplane'), ('CPC', '49623: Aeroplanes and other powered aircraft of an unladen weight exceeding 2000 kg')];market for wastewater, unpolluted;-437.2396486016;cubic meter;wastewater, unpolluted;25564.4149384;technosphere;RoW
47206eea902310785030489d1894a803;electricity production, photovoltaic, 3kWp slanted-roof installation, multi-Si, panel, mounted;CN-SD;electricity, low voltage;;[('EcoSpold01Categories', 'photovoltaic/power plants'), ('ISIC rev.4 ecoinvent', '3510:Electric power generation, transmission and distribution'), ('CPC', '17100: Electrical energy')];market for wastewater, from residence;-4.48585231193926e-06;cubic meter;wastewater, from residence;53.6956521739129;technosphere;RoW
4747735dc28db828c82d81f124009f87;fibre cement facing tile production, large format;RoW;fibre cement facing tile, large format;;[('ISIC rev.4 ecoinvent', '2395:Manufacture of articles of concrete, cement and plaster'), ('EcoSpold01Categories', 'construction materials/coverings'), ('CPC', '37540: Tiles, flagstones, bricks and similar articles, of cement, concrete or artificial stone')];market for wastewater, unpolluted;-6.464e-05;cubic meter;wastewater, unpolluted;0.00019392;technosphere;RoW
4752fdb6724d98a4abea4e5af560cbf5;electricity production, photovoltaic, 570kWp open ground installation, multi-Si;CN-LN;electricity, low voltage;;[('EcoSpold01Categories', 'photovoltaic/power plants'), ('ISIC rev.4 ecoinvent', '3510:Electric power generation, transmission and distribution'), ('CPC', '17100: Electrical energy')];market for wastewater, from residence;-2.68857428920057e-08;cubic meter;wastewater, from residence;0.0;technosphere;RoW
475de2c2cd21e5a3994c8e56f80be959;butyldiglycol acetate production;GLO;butyldiglycol acetate;;[('ISIC rev.4 ecoinvent', '2011:Manufacture of basic chemicals'), ('CPC', '34170: Ethers, alcohol peroxides, ether peroxides, epoxides, acetals and hemiacetals, and their halogenated, sulphona[…]')];market for wastewater, average;-8.43645500899092e-07;cubic meter;wastewater, average;938.793103448275;technosphere;Europe without Switzerland
475de2c2cd21e5a3994c8e56f80be959;butyldiglycol acetate production;GLO;butyldiglycol acetate;;[('ISIC rev.4 ecoinvent', '2011:Manufacture of basic chemicals'), ('CPC', '34170: Ethers, alcohol peroxides, ether peroxides, epoxides, acetals and hemiacetals, and their halogenated, sulphona[…]')];market for wastewater, average;-9.12667023214788e-08;cubic meter;wastewater, average;938.793103448275;technosphere;CH
475de2c2cd21e5a3994c8e56f80be959;butyldiglycol acetate production;GLO;butyldiglycol acetate;;[('ISIC rev.4 ecoinvent', '2011:Manufacture of basic chemicals'), ('CPC', '34170: Ethers, alcohol peroxides, ether peroxides, epoxides, acetals and hemiacetals, and their halogenated, sulphona[…]')];market for wastewater, average;-1.76508779677943e-06;cubic meter;wastewater, average;938.793103448275;technosphere;RoW
477aa063e19e27034cc6f06f3ba1f587;structural timber production;RoW;structural timber;;[('ISIC rev.4 ecoinvent', '1621:Manufacture of veneer sheets and wood-based panels')];market for wastewater from particleboard production;-0.023204;cubic meter;wastewater from particleboard production;185632.0;technosphere;GLO
479215615b15b44fdac911789fd3ffb3;electricity production, photovoltaic, 3kWp slanted-roof installation, multi-Si, panel, mounted;US-HICC;electricity, low voltage;;[('ISIC rev.4 ecoinvent', '3510:Electric power generation, transmission and distribution'), ('EcoSpold01Categories', 'photovoltaic/power plants'), ('CPC', '17100: Electrical energy')];market for wastewater, from residence;-4.44106842862542e-06;cubic meter;wastewater, from residence;6.43954922150686;technosphere;RoW
47f534b13819a87ad9eb3e4fb39ac859;market for wastewater from cathode ray tube production;GLO;wastewater from cathode ray tube production;;[('ISIC rev.4 ecoinvent', '3700:Sewerage'), ('EcoSpold01Categories', 'waste management/wastewater treatment'), ('CPC', '39920: Sewage sludge')];treatment of wastewater from cathode ray tube production, capacity 1.1E10l/year;-0.008416885559675;cubic meter;wastewater from cathode ray tube production;0.0;technosphere;CH
47f534b13819a87ad9eb3e4fb39ac859;market for wastewater from cathode ray tube production;GLO;wastewater from cathode ray tube production;;[('ISIC rev.4 ecoinvent', '3700:Sewerage'), ('EcoSpold01Categories', 'waste management/wastewater treatment'), ('CPC', '39920: Sewage sludge')];treatment of wastewater from cathode ray tube production, capacity 1.1E10l/year;-0.991583114440325;cubic meter;wastewater from cathode ray tube production;0.0;technosphere;RoW
47f5a3fa8735dd27fb1210e4b635906b;market for ethanol, without water, in 99.7% solution state, from fermentation, vehicle grade;CH;ethanol, without water, in 99.7% solution state, from fermentation, vehicle grade;;[('EcoSpold01Categories', 'biomass/fuels'), ('ISIC rev.4 ecoinvent', '2011:Manufacture of basic chemicals'), ('CPC', '35491: Biodiesel')];treatment of wastewater, average, capacity 1.1E10l/year;-6.89e-07;cubic meter;wastewater, average;0.0;technosphere;CH
47f9e9102e4bb6492b0f97593bf3d39e;rare earth oxides production, from rare earth carbonate concentrate;RoW;neodymium oxide;;[('ISIC rev.4 ecoinvent', '0729:Mining of other non-ferrous metal ores'), ('CPC', '3429: Compounds of rare earth metals, of yttrium or of scandium')];market for wastewater, average;-0.00644633554933713;cubic meter;wastewater, average;939282.288485449;technosphere;CH
47f9e9102e4bb6492b0f97593bf3d39e;rare earth oxides production, from rare earth carbonate concentrate;RoW;neodymium oxide;;[('ISIC rev.4 ecoinvent', '0729:Mining of other non-ferrous metal ores'), ('CPC', '3429: Compounds of rare earth metals, of yttrium or of scandium')];market for wastewater, average;-0.0595882380446681;cubic meter;wastewater, average;939282.288485449;technosphere;Europe without Switzerland
4823c0bfef4efbfb0bc55810afc9b35d;heat and power co-generation, wood chips, 6667 kW;TH;heat, district or industrial, other than natural gas;;[('ISIC rev.4 ecoinvent', '3530:Steam and air conditioning supply'), ('CPC', '17300: Steam and hot water')];market for wastewater, average;-1.74888888888889e-06;cubic meter;wastewater, average;36293.292;technosphere;RoW
4892128abc34b1004aa9b8b088315b20;rye grain, feed production, Swiss integrated production;CH;rye grain, feed, Swiss integrated production;;[('ISIC rev.4 ecoinvent', '1080:Manufacture of prepared animal feeds'), ('EcoSpold01Categories', 'agricultural means of production/feed'), ('CPC', '23319: Preparations used in animal feeding n.e.c.')];treatment of wastewater, average, capacity 1.1E10l/year;-3.8e-05;cubic meter;wastewater, average;369.892;technosphere;CH
48952450c7578bf4a4e01b1ddcbfbd91;generator production, mini CHP plant;RoW;generator, mini CHP plant;;[('EcoSpold01Categories', 'natural gas/cogeneration'), ('ISIC rev.4 ecoinvent', '2710:Manufacture of electric motors, generators, transformers and electricity di'), ('CPC', '461: Electric motors, generators and transformers, and parts thereof')];market for wastewater from pig iron production;-0.00167707931848197;cubic meter;wastewater from pig iron production;0.0432;technosphere;Europe without Switzerland
48952450c7578bf4a4e01b1ddcbfbd91;generator production, mini CHP plant;RoW;generator, mini CHP plant;;[('EcoSpold01Categories', 'natural gas/cogeneration'), ('ISIC rev.4 ecoinvent', '2710:Manufacture of electric motors, generators, transformers and electricity di'), ('CPC', '461: Electric motors, generators and transformers, and parts thereof')];market for wastewater from pig iron production;-0.012722920681518;cubic meter;wastewater from pig iron production;0.0432;technosphere;RoW
48b3ae0716c0e21280a37d632ca4529b;NMC811 hydroxide production, for Li-ion battery;RoW;NMC811 hydroxide;;"[('ISIC rev.4 ecoinvent', '2011:Manufacture of basic chemicals'), ('CPC', '34220: Zinc oxide; zinc peroxide; chromium oxides and hydroxides; manganese oxides; iron oxides and hydroxides; earth[…]')]";market for wastewater, average;-6.23052307157303e-05;cubic meter;wastewater, average;8614.26104300113;technosphere;CH
48b3ae0716c0e21280a37d632ca4529b;NMC811 hydroxide production, for Li-ion battery;RoW;NMC811 hydroxide;;"[('ISIC rev.4 ecoinvent', '2011:Manufacture of basic chemicals'), ('CPC', '34220: Zinc oxide; zinc peroxide; chromium oxides and hydroxides; manganese oxides; iron oxides and hydroxides; earth[…]')]";market for wastewater, average;-0.000575933240040332;cubic meter;wastewater, average;8614.26104300113;technosphere;Europe without Switzerland
48b47c15853622ff22239970a448962e;maintenance, intermodal shipping container, 45-foot, high-cube;GLO;maintenance, intermodal shipping container, 45-foot, high-cube;;[('EcoSpold01Categories', 'transport systems/train'), ('ISIC rev.4 ecoinvent', '3315:Repair of transport equipment, except motor vehicles'), ('CPC', '87149: Maintenance and repair services of other transport equipment')];market for wastewater, unpolluted;-0.0459;cubic meter;wastewater, unpolluted;4719093.75;technosphere;CH
48b47c15853622ff22239970a448962e;maintenance, intermodal shipping container, 45-foot, high-cube;GLO;maintenance, intermodal shipping container, 45-foot, high-cube;;[('EcoSpold01Categories', 'transport systems/train'), ('ISIC rev.4 ecoinvent', '3315:Repair of transport equipment, except motor vehicles'), ('CPC', '87149: Maintenance and repair services of other transport equipment')];market for wastewater, unpolluted;-5.6916;cubic meter;wastewater, unpolluted;4719093.75;technosphere;RoW
